<?xml version="1.0" encoding="UTF-8"?>
<xs:schema xmlns:xs="http://www.w3.org/2001/XMLSchema">
	<xs:element name="Company">
		<xs:complexType>
			<xs:sequence>
				<xs:element name="Company" maxOccurs="unbounded">
					<xs:complexType>
						<xs:sequence>
							<xs:element name="Emp-name" type="xs:string"></xs:element>
							<xs:element name="Emp-age" type="xs:integer"></xs:element>
							<xs:element name="Emp-salary" type="MySal"></xs:element>
							<xs:element name="Emp-emailid" type="xs:string"></xs:element>
							<xs:element name="Emp-phonenum" type="xs:double"></xs:element>
							<xs:element name="Emp-designation" type="xs:string"></xs:element>
						</xs:sequence>
						<xs:attribute name="eid" type="xs:string" use="required" />
					</xs:complexType>
				</xs:element>
			</xs:sequence>
		</xs:complexType>
	</xs:element>
	<xs:simpleType name="MySal">
		<xs:restriction base="xs:integer">
			<xs:minInclusive value="50000"></xs:minInclusive>
			<xs:maxInclusive value="2000000"></xs:maxInclusive>
		</xs:restriction>
	</xs:simpleType>
</xs:schema>

